{
  "schema_version":"canon_execution_event_v1","event_id":"EXEC-EVENT-RUN-20260718-FIXTURE1-000012","event_type":"run_terminal","sequence_number":12,"timestamp_utc":"2026-07-18T15:15:00Z",
  "actor":{"actor_id":"fixture-operator","tool_name":"fixture-execution-writer","tool_version":"fixture-only-v1","tool_source_path":"scratch/WP-CANON-DISPATCH-CONTROL-PLANE-DESIGN-LOCK-01/fixtures/fixture_execution_writer.py","tool_source_sha256":"sha256:3333333333333333333333333333333333333333333333333333333333333333"},
  "bindings":{"dispatch_id":"DSP-20260718-FIXTURE1","dispatch_record_path":"research/queue/dispatch_records/DSP-20260718-FIXTURE1.dispatch_record.json","dispatch_record_sha256":"sha256:a147bbcceeda987c39f741bdac7fa49f760c41498d4b79a4c787dd7677c153be","run_id":"RUN-20260718-FIXTURE1","queue_item_id":"QI-20260717-H004R2B1"},
  "stream_path":"research/queue/execution_events/RUN-20260718-FIXTURE1.execution_events.jsonl",
  "run_terminal":{"terminal_state":"run_blocked","terminal_reason_code":"fail_closed_stop_condition","process_started":true,"denominator_accounting":{"basis":"committed_pre_registered_population_count","planned":81,"attempts_recorded":10,"population_accounted_total":81,"not_attempted":71,"outcome_counts":{"successful":9,"failed":1,"invalid":0,"excluded":0,"errored":0,"aborted":0,"filtered":0,"data_unavailable":0,"not_attempted":71},"mismatch_policy":"reject"},"budget":{"metric":"variant_attempts","upper_bound":81,"actual":10,"unit":"attempts","retries_included":true,"retry_allowance":0,"comparison":"actual_lte_upper_bound","mismatch_or_exceed_policy":"reject"}},
  "non_authority_declaration":{"control_plane_history_only":true,"not_canonical_strategy_performance_evidence":true,"not_result_population_authority":true,"not_exp_replacement":true,"not_rep_replacement":true,"not_outcome_ledger_replacement":true,"not_recommendation_replacement":true,"not_decision_replacement":true,"not_ranking_authority":true,"not_recommendation_authority":true,"not_readiness_authority":true,"not_promotion_authority":true,"not_candidate_authority":true,"not_scheduler_authority":true,"not_runtime_authority":true,"not_paper_live_authority":true,"canonical_result_population_write_forbidden":true}
}
